{
  "schemaVersion": "1.0.0",
  "gameType": "ODD_ONE_OUT",
  "metadata": {
    "title": "Ví dụ ODD_ONE_OUT",
    "subject": "MATH",
    "gradeLevel": "GRADE_1",
    "topic": "Chủ đề mẫu"
  },
  "gameplaySettings": {
    "hitboxScale": 1.5
  },
  "questions": [
    {
      "id": "q1",
      "timeLimitSeconds": 30,
      "points": 10,
      "audioText": "Con nào khác loại?",
      "items": [
        {
          "id": "a",
          "text": "mèo"
        },
        {
          "id": "b",
          "text": "chó"
        },
        {
          "id": "c",
          "text": "thỏ"
        },
        {
          "id": "d",
          "text": "xe hơi"
        }
      ],
      "oddOneOutId": "d"
    },
    {
      "id": "q2",
      "timeLimitSeconds": 30,
      "points": 10,
      "items": [
        {
          "id": "a",
          "text": "táo"
        },
        {
          "id": "b",
          "text": "chuối"
        },
        {
          "id": "c",
          "text": "ghế"
        }
      ],
      "oddOneOutId": "c"
    }
  ]
}
